11409,219,106922,Probably around shoulder adult according what lawyer.,0,problem z silnikiem
11410,307,106929,Likely budget civil wear. Wide east TV law.,1,kolizja
11411,250,106939,Under crime likely off institution watch.,1,problem z silnikiem
11412,254,106943,So anyone crime place account present one short.,0,drobna usterka
11413,220,106944,Least foreign wrong. Plan paper wait whatever no exist do consumer.,1,drobna usterka
11414,284,106951,Include know cause security suggest. Goal modern medical network five.,1,wykolejenie
11415,224,106960,Seek reveal build field art bed. Court attention blue son boy.,0,kolizja
11416,270,106961,Score exist any real purpose can. Thousand everybody ball impact.,1,kolizja
11417,227,106967,So thank discover list age radio. Rise speech ok.,1,wykolejenie
11418,316,106971,Again general now director oil. Million environment mouth buy.,0,drobna usterka
11419,281,106972,Month participant movement message authority rock. Building action fine baby.,0,kolizja
11420,226,106973,Pull move although same compare read. Star dog else apply not.,1,problem z silnikiem
11421,238,106975,Realize argue fly yeah. Evidence others role represent key.,1,drobna usterka
11422,294,106976,For process weight since less might series recent.,1,wykolejenie
11423,220,106981,Wall cultural miss check arrive work time worry. Here oil property democratic.,1,problem z silnikiem
11424,301,106990,Happy true free require. Indicate democratic ready.,0,problem z silnikiem
11425,203,106997,Everyone these record remain. Do popular build especially woman.,0,problem z silnikiem
11426,227,107003,Lawyer work throughout perhaps evidence.,0,drobna usterka
11427,237,107009,Not girl agent. Task style hear direction rule.,1,drobna usterka
11428,308,107014,Senior man happy bill vote green. Interview lead somebody.,1,kolizja
11429,251,107024,Sometimes ok there their car. Name expert deep number sing.,1,wykolejenie
11430,269,107029,Because say sing. Board want may space begin. Drug cup control item.,0,wykolejenie
11431,278,107050,Name writer exist accept. Perhaps pass arm nearly rise window.,1,wykolejenie
11432,298,107051,Watch cup happy. Difference population something take.,1,kolizja
11433,249,107055,Occur cause image letter wall. Piece check future. Sing news size me know.,1,wykolejenie
11434,279,107058,Bank blood nor. Camera condition suggest. Education give choice south go.,0,problem z silnikiem
11435,230,107075,Cell according second life. Certainly easy world property surface Mrs.,0,kolizja
11436,239,107082,Standard group model fast. Important act happy house outside pay economy.,1,kolizja
11437,261,107090,Could machine especially wind apply type more effort.,1,drobna usterka
11438,279,107092,Everyone try throw. Lead option future her list son. One thing put adult else.,0,problem z silnikiem
11439,297,107103,Ten themselves everything. Consumer not series six hard positive rather.,1,drobna usterka
11440,224,107105,Quality reach record do cultural really.,1,problem z silnikiem
11441,294,107106,By off pull there which lead. Half cut agency add. Prevent phone race station.,1,drobna usterka
11442,235,107110,Always area picture operation true situation. Doctor take wear nice.,1,drobna usterka
11443,310,107112,Television minute candidate information.,1,drobna usterka
11444,292,107115,Ball their war fish. Military range sit cultural tonight sister pull.,1,wykolejenie
11445,309,107118,Take cultural start note green majority.,1,kolizja
11446,283,107121,About TV point him. Party or purpose catch member pay.,1,kolizja
11447,285,107124,Must material bad resource window.,1,wykolejenie
11448,253,107128,On join near Mr. Manage young particularly produce wear prepare by.,0,problem z silnikiem
11449,228,107133,Mrs teacher director group up teach. Beat message create significant music.,0,kolizja
11450,315,107134,Everyone design during stuff beautiful maintain act meet.,1,wykolejenie
11451,206,107143,Institution cup piece memory must head. Individual wide population.,0,kolizja
11452,222,107148,Yourself notice ability card election address exactly bar.,1,problem z silnikiem
11453,305,107149,Relate tax run apply. See house condition and she.,1,wykolejenie
11454,256,107159,Push indicate source try magazine easy.,1,wykolejenie
11455,269,107163,Strong there actually yourself some majority little.,0,wykolejenie
11456,285,107166,Book lawyer picture issue interesting compare.,0,wykolejenie
11457,307,107168,Ready until religious. Skill success imagine bring agent.,1,kolizja
11458,267,107176,Team oil carry. True best dinner.,0,drobna usterka
11459,249,107181,Exactly instead community together model answer herself science.,0,kolizja
11460,295,107182,Long relationship drop black guy.,1,kolizja
11461,270,107185,Eye arm view spring cold suggest. Two professional able effort.,0,wykolejenie
11462,244,107186,Her develop herself. Report particular arrive shake walk.,1,kolizja
11463,256,107193,Low by I move blue past draw. Author strong music million skill.,1,drobna usterka
11464,202,107197,Marriage little real true even sell else above.,0,problem z silnikiem
11465,286,107208,Tell step court this shoulder go. Success either hit.,1,drobna usterka
11466,288,107232,Look charge war value pressure. Military fine your choose.,1,wykolejenie
11467,236,107240,President reason approach. Skin sound break response.,0,wykolejenie
11468,203,107242,Pretty option scene country hotel.,1,wykolejenie
11469,265,107244,Everyone receive enough others interesting by. Budget daughter husband.,1,kolizja
11470,301,107245,Collection wife suffer case. Politics for near now these.,1,kolizja
11471,297,107247,Information them believe bad reflect probably learn different.,1,drobna usterka
11472,307,107258,Science rule fund student small air. Month create recognize risk blue culture.,1,kolizja
11473,214,107262,Any not hit east model. Society western they director her me bring.,1,drobna usterka
11474,221,107266,Dream evidence figure mouth he job sit. Action middle themselves research Mrs.,1,kolizja
11475,311,107285,You week compare unit institution make off. Watch blue body occur serve.,1,drobna usterka
11476,270,107287,Production concern team resource Mrs. Human you war computer.,1,problem z silnikiem
11477,296,107289,International three dark social face push election. Letter entire still.,0,drobna usterka
11478,254,107292,Air father too whatever truth. To government tough.,1,wykolejenie
11479,242,107297,Summer chair check material. Health town toward hit or thank.,1,problem z silnikiem
11480,273,107298,Measure agent study culture. Season three outside event without theory four.,0,kolizja
11481,222,107300,Public guy past all process imagine.,0,drobna usterka
11482,259,107312,Second those join reduce. Save carry million human let thing.,0,problem z silnikiem
11483,245,107313,To president material. Seven lead subject. Choice interesting other present.,0,kolizja
11484,204,107319,Whether computer almost civil customer.,1,problem z silnikiem
11485,219,107321,Ground doctor agent play couple third election.,0,drobna usterka
11486,294,107329,Clearly little any add go natural. Any avoid style.,1,problem z silnikiem
11487,277,107332,Four wife police white current morning. Candidate together which.,0,wykolejenie
11488,253,107333,Grow occur itself information director individual.,1,wykolejenie
11489,230,107334,Leader travel card good health. Stop analysis others reality kid.,1,kolizja
11490,306,107335,Far wrong majority southern throw happen.,1,drobna usterka
11491,201,107336,As five pick live. Seat peace miss citizen serious.,0,wykolejenie
11492,273,107340,Parent south hair spring mother suffer. Reduce fish care.,0,problem z silnikiem
11493,231,107344,Tv just upon leader skill daughter computer.,1,drobna usterka
11494,251,107347,Side hotel difference likely carry religious pass.,1,problem z silnikiem
11495,232,107349,Cover draw work billion. Skill role easy move build mission.,1,problem z silnikiem
11496,228,107352,Low enough true factor name garden art. He get American pressure century pull.,1,wykolejenie
11497,306,107353,Congress Republican Mr easy store.,1,kolizja
11498,222,107355,Congress least keep process impact listen.,1,kolizja
11499,205,107356,White old decade approach study book alone.,0,problem z silnikiem
11500,314,107360,Create maintain find such happen.,1,wykolejenie
11501,237,107376,Artist attention season close. Important look first range.,0,wykolejenie
11502,297,107378,Great budget third fly fish. Professional already without.,0,kolizja
11503,224,107381,All suggest rate form general protect.,1,wykolejenie
11504,219,107387,Might suffer today relate bar heart modern point.,1,problem z silnikiem
11505,283,107393,Such subject act give cultural.,1,kolizja
11506,205,107404,Face success key thus wish. Laugh bit shake.,1,problem z silnikiem
11507,307,107409,Town add audience technology tonight meet.,1,kolizja
11508,233,107420,Development woman join south hope. State question alone crime.,1,drobna usterka
11509,206,107432,Throughout drive wait traditional save age perform.,1,wykolejenie
11510,309,107440,Heavy now address seven level. Put indicate pass mission remain.,1,problem z silnikiem
11511,271,107441,Letter win continue worry gas plant.,1,kolizja
11512,244,107447,Natural star two development foreign. Should view company into itself manager.,1,drobna usterka
11513,287,107453,Color late store environment suddenly.,1,drobna usterka
11514,292,107456,Within big level hold several conference. Recently law cost two.,1,drobna usterka
11515,253,107457,Stage over return foot operation.,1,wykolejenie
11516,228,107458,Cell impact foot capital from walk later.,1,wykolejenie
11517,294,107482,Star certainly professional rock box. Day operation effect like sell whose.,1,kolizja
11518,280,107488,Manager despite only side all significant.,1,drobna usterka
11519,313,107494,Building operation less office. Knowledge per usually my.,0,wykolejenie
11520,247,107504,Service any most thought work.,1,kolizja
11521,209,107506,Go yard them. What huge card discuss data lead.,0,problem z silnikiem
11522,224,107508,Else deep hour way thousand possible almost.,1,kolizja
11523,290,107514,Sometimes argue subject store high certainly hit.,0,drobna usterka
11524,300,107515,Item possible hour grow market often charge.,0,wykolejenie
11525,228,107517,Instead for degree late sure sell tough.,0,problem z silnikiem
11526,205,107522,Field turn city single loss. Send into stop only toward stand will.,0,drobna usterka
11527,209,107526,Their level turn agreement. Training expert war miss sort.,1,problem z silnikiem
11528,227,107531,Sit suddenly alone pull add detail buy. Land thank across.,0,kolizja
11529,212,107536,Free believe cup finally interview school end. Perform poor build soon cell.,0,wykolejenie
11530,243,107539,Help yourself national ten store our cause.,1,drobna usterka
11531,295,107540,Author job human among. Goal campaign get also if peace late.,0,kolizja
11532,256,107542,Serve either within after opportunity full when window.,1,wykolejenie
11533,282,107546,Environment whether fine help skill today simple. Eat likely they.,0,wykolejenie
11534,219,107569,Ball gun buy issue commercial charge. Attorney action person its ever.,1,drobna usterka
11535,246,107573,Feeling us pass hair support.,1,drobna usterka
11536,308,107586,Instead skin music. Improve tough court sense. Want building ball hold.,1,drobna usterka
11537,310,107588,Trial report relationship drive top. Opportunity today effect.,1,problem z silnikiem
11538,201,107593,Old despite it sign throw. Soon if woman mind smile I understand.,1,kolizja
11539,232,107612,Fund whose score result bed bag once. Stock nothing road support story unit.,0,kolizja
11540,239,107614,Mrs eight whatever fund. So the nature themselves house.,0,drobna usterka
11541,225,107620,Man poor may center.,1,wykolejenie
11542,272,107625,Next condition ball treatment already major light.,1,wykolejenie
11543,264,107639,Contain off majority describe believe serious believe.,0,problem z silnikiem
11544,318,107641,Population father over big weight lot Mr work.,1,drobna usterka
11545,210,107646,Response page force offer discuss while picture. Great simple great fire.,1,wykolejenie
11546,248,107649,Recent grow drop. Own structure reach hair. Method thought former nation.,0,kolizja
11547,242,107652,Within group perhaps decide local. Moment care cover a.,1,problem z silnikiem
11548,307,107653,Economy century organization detail.,1,drobna usterka
11549,276,107655,Amount see those process range wall little see. Off action yourself election.,1,wykolejenie
11550,224,107669,Customer operation family. Today baby company thus.,1,problem z silnikiem
11551,276,107671,Leave prevent suggest newspaper bit nature. Local character camera woman.,1,wykolejenie
11552,286,107674,Natural financial across gun might.,1,wykolejenie
11553,300,107677,Exactly traditional board fight state ok high.,1,drobna usterka
11554,271,107685,No also chance enter position bill various. Pressure long best energy.,0,wykolejenie
11555,294,107689,Image machine hit fill people child he life.,1,drobna usterka
11556,223,107704,Director total tree western may professional size look.,1,problem z silnikiem
11557,314,107707,Story company instead finish care. Partner prevent positive daughter any.,1,kolizja
11558,221,107712,Guy former adult party material practice.,0,problem z silnikiem
11559,288,107713,Brother real religious machine information treat lay get.,0,wykolejenie
11560,251,107719,Material place country human benefit piece president describe.,1,problem z silnikiem
11561,262,107724,Pick money large chair show. Response how land difference without tonight.,1,drobna usterka
11562,298,107727,Me season exactly knowledge case nice traditional explain.,1,drobna usterka
11563,235,107733,Compare computer perhaps financial yes once.,0,problem z silnikiem
11564,256,107734,Pay live political. Upon senior our nearly speak six step seem.,1,drobna usterka
11565,297,107737,Support bed this type could water.,1,problem z silnikiem
11566,300,107738,Writer table himself help can magazine should player.,1,kolizja
11567,217,107744,Lawyer cultural case everything natural system cultural.,1,kolizja
11568,260,107749,Never government country. Walk near each place music form participant.,0,wykolejenie
11569,232,107753,Party explain particular. Upon long room. Model little who red act.,1,drobna usterka
11570,299,107755,Example recent style relate. Next bit image deep market.,0,kolizja
11571,269,107760,Major cover she also ground finally. Produce anyone sometimes treat business.,1,wykolejenie
11572,224,107762,Region avoid ask who risk industry. School me system see wrong serve.,1,wykolejenie
11573,242,107766,Radio glass party black those impact.,1,drobna usterka
11574,296,107771,Environment not away deal close serious heavy week.,1,kolizja
11575,308,107777,Water church claim head cut. Support fish memory mother wide another upon.,0,drobna usterka
11576,218,107787,Arrive before check result. Tough drug message quality.,1,kolizja
11577,317,107790,Less save today including. Throw they film whom heart will.,0,wykolejenie
11578,258,107802,Continue and rather nothing under side.,1,kolizja
11579,230,107805,Thousand dinner market inside simple expert way.,1,kolizja
11580,224,107810,Agreement them new fight. While late discover hope.,1,wykolejenie
11581,302,107819,Away strategy later five clearly. Dark late trouble language impact computer.,1,problem z silnikiem
11582,231,107825,Ahead continue lawyer personal step two. Easy magazine data benefit.,0,wykolejenie
11583,257,107830,Would when available through. Particularly floor memory knowledge.,1,kolizja
11584,259,107834,Pass newspaper future staff new behind go likely.,1,wykolejenie
11585,236,107835,List think increase police various one. Young us still.,0,problem z silnikiem
11586,244,107837,According subject space interest describe over feeling.,0,wykolejenie
11587,295,107846,Business teach tend close expect former.,1,problem z silnikiem
11588,271,107852,Foot election order keep left painting mission.,1,wykolejenie
11589,218,107855,We know option sound price suggest. Win movement animal ok whatever.,1,wykolejenie
11590,242,107856,Hair miss someone table adult. Her happen goal develop school.,0,drobna usterka
11591,256,107864,From effort significant agency position chance television.,1,wykolejenie
11592,290,107874,Imagine amount education however media anything sister.,1,wykolejenie
11593,257,107876,Ability during million remain tonight any.,1,wykolejenie
11594,287,107879,Whether dream son hold tough involve admit body.,0,kolizja
11595,283,107883,Door push military enter. Man piece class feeling firm main beyond national.,0,wykolejenie
11596,231,107884,Them role successful learn language.,1,kolizja
11597,285,107888,Policy trial than help all serve southern.,1,kolizja
11598,221,107890,Age why account generation tax campaign.,1,drobna usterka
11599,201,107904,Boy process protect. Have protect language. Song much in see property.,1,drobna usterka
11600,277,107915,If rest kid officer ready thus fear. Ready light note here imagine bit.,1,wykolejenie
11601,279,107917,Magazine rich close message approach. Note create claim his break miss.,1,problem z silnikiem
11602,205,107918,World check approach himself effect administration why.,0,problem z silnikiem
11603,268,107920,World charge small spend could bed force. Lead other loss.,0,drobna usterka
11604,261,107931,Teach art mother police.,1,problem z silnikiem
11605,224,107938,Approach beautiful many box option audience market.,1,problem z silnikiem
11606,239,107943,Establish choice debate special wonder. Begin later else know evidence.,0,drobna usterka
11607,207,107951,Author close message trip from scene. Consider own career.,1,drobna usterka
11608,292,107960,Morning newspaper teacher provide. Age can answer city soon size more.,0,drobna usterka
11609,219,107978,Four trial source message door.,1,wykolejenie
11610,308,107989,Heavy edge study simple professional fish suddenly.,0,problem z silnikiem
11611,318,107997,Should pattern opportunity life assume. Usually hotel billion debate.,1,problem z silnikiem
11612,228,108011,Free another economic attack close conference public.,1,problem z silnikiem
11613,293,108012,Candidate white policy use hit enough life.,1,wykolejenie
11614,301,108013,There along consider policy crime heart responsibility training.,1,drobna usterka
11615,280,108018,Political until meeting true. Minute organization run live.,1,drobna usterka
11616,258,108024,Hope hear north. Data most along worry bill catch provide.,1,drobna usterka
11617,282,108031,Attack question quickly represent cultural increase.,0,kolizja
11618,215,108032,Break true society fear such go security. Themselves trouble far since.,0,problem z silnikiem
11619,234,108033,Its my probably white executive entire big. Firm moment clearly.,1,drobna usterka
11620,222,108038,Whatever today ask wind factor throw.,0,problem z silnikiem
11621,231,108044,Whom major his quality day. Now wrong conference effect action.,1,drobna usterka
11622,235,108059,Us contain look style news focus dinner.,1,problem z silnikiem
11623,225,108062,Anyone study southern treatment management.,1,kolizja
11624,221,108063,Soldier though method development. Song left road enter carry public mission.,1,kolizja
11625,290,108066,Cause necessary follow them within moment.,1,kolizja
11626,307,108072,International improve others call name.,1,problem z silnikiem
11627,290,108073,On study better news any recognize student. Loss behind idea seek culture.,1,wykolejenie
11628,209,108083,Southern commercial investment common wife.,0,drobna usterka
11629,250,108085,Successful what line environmental.,1,kolizja
11630,296,108098,Pretty coach last statement. Not ten information wait newspaper strategy.,1,wykolejenie
11631,239,108101,Your pull nor late marriage series show. Red any notice tend.,1,kolizja
11632,201,108105,Person central campaign about someone let meet capital.,1,kolizja
11633,231,108106,Civil better price letter. Center dark foot bag try rock.,1,wykolejenie
11634,264,108109,Believe what age. Unit detail central partner property general.,1,problem z silnikiem
11635,209,108110,Development then different figure. Me safe claim couple economic believe.,1,problem z silnikiem
11636,286,108111,Throw bad player last. Include get small black area station.,0,wykolejenie
11637,282,108112,President character heart. Machine ability necessary nothing present clearly.,1,problem z silnikiem
11638,209,108114,Happy of focus wonder shoulder sure environment.,1,kolizja
11639,276,108116,Usually capital address any care throughout. More card church none different.,1,kolizja
11640,223,108123,Consider air show product plant network popular.,0,wykolejenie
11641,273,108127,Group cut arm it. Gun four movie. Whose enter discover.,1,drobna usterka
11642,257,108136,Consider process buy lose. Serve truth animal appear brother person picture.,1,problem z silnikiem
11643,286,108137,Present method fact mission. Method else significant.,1,problem z silnikiem
11644,240,108138,International lay lot discussion picture professional cut.,0,wykolejenie
11645,211,108147,Black about eat this represent per notice. Consider believe tonight.,1,problem z silnikiem
11646,220,108149,Public specific likely individual. Pm line land actually.,0,problem z silnikiem
11647,207,108151,Why into oil. Artist dog fight involve side entire on.,1,problem z silnikiem
11648,239,108163,Reveal fall detail tend medical tax kitchen. Investment one fish race deal.,1,wykolejenie
11649,225,108168,Necessary adult player attention television executive.,1,drobna usterka
11650,285,108187,Collection at month card consider always. Over brother what lay every.,1,problem z silnikiem
11651,265,108189,Clearly better mention deep happy message. Meeting Congress find system point.,1,kolizja
11652,298,108191,Cultural brother bed rest. Information think budget produce organization know.,1,problem z silnikiem
11653,242,108201,Fly involve record. This act appear sign subject.,1,kolizja
11654,264,108204,Perform impact this sense risk if. Lawyer large treatment.,1,kolizja
11655,218,108207,Board among performance such stock.,0,drobna usterka
11656,274,108210,His value onto seek live. Social however million step game.,1,problem z silnikiem
11657,302,108214,Heavy two method sign decade.,0,kolizja
11658,269,108215,Challenge from book arrive into present pass. Necessary wall short whom bad.,1,kolizja
11659,253,108217,Condition perform science then. Executive old game smile.,0,kolizja
11660,319,108218,Student strategy onto agency chair station. Store above enough.,1,wykolejenie
11661,298,108219,Arrive without system boy. Community either serve onto process after star his.,1,problem z silnikiem
11662,300,108229,Team each maybe imagine. Visit close building couple suggest foot final.,1,drobna usterka
11663,299,108245,Health when throughout reduce again. Court price enough class wind cost hotel.,1,wykolejenie
11664,214,108249,The yet research executive set pressure. Cover reality subject.,1,wykolejenie
11665,301,108259,Stock reveal others too particular. Light score kind affect year.,1,kolizja
11666,272,108261,Popular happen hard western meeting future.,0,wykolejenie
11667,244,108265,Which us moment statement huge tend important. Ready break foot too.,1,kolizja
11668,277,108269,Bag word manager science. Girl water land people tend we.,0,wykolejenie
11669,278,108273,Huge though our campaign local teach. See hand explain money manage large.,1,drobna usterka
11670,264,108292,Several movie war charge hope yes. Out gas service take style.,0,problem z silnikiem
11671,209,108299,Nice view goal write moment. Help begin be piece.,1,kolizja
11672,232,108304,Activity send foreign bill happen issue. Live whose matter sure.,1,problem z silnikiem
11673,256,108305,Politics development early religious prove. Weight able what.,0,wykolejenie
11674,224,108308,Carry part step offer respond party customer born.,1,problem z silnikiem
11675,204,108329,Environmental watch any central effect no PM expect.,1,problem z silnikiem
11676,306,108330,There police off decade account. Everything those effect approach produce.,1,problem z silnikiem
11677,262,108336,Seven inside machine carry least. Current effort including investment number.,0,wykolejenie
11678,210,108346,Form forward commercial. Nothing father amount along person term.,1,kolizja
11679,256,108349,Eye particularly tonight use box send environment spend.,1,drobna usterka
11680,213,108364,Report safe ever stand hope. Ahead must information left everything guess.,1,kolizja
11681,274,108372,Property particularly hot away child. Good wrong event fall wait.,1,wykolejenie
11682,313,108375,Power draw yeah cell nature attention want mother.,1,drobna usterka
11683,213,108376,Moment product can fall tell mean nearly.,1,drobna usterka
11684,269,108381,Almost we often product. Wide young stuff this gun make.,0,drobna usterka
11685,240,108392,Worry budget human nearly open her. Manager girl must.,1,drobna usterka
11686,253,108405,Value yet society apply provide story green.,0,problem z silnikiem
11687,313,108407,Speech site there pull bank. While board role right about alone.,0,wykolejenie
11688,312,108411,Once professional middle participant account spring quite garden.,1,kolizja
11689,263,108414,Other film student medical actually language cup. Whatever close pick usually.,0,problem z silnikiem
11690,255,108422,Executive peace lead rise huge perform.,0,wykolejenie
11691,292,108440,Economic dinner decide customer accept size.,1,drobna usterka
11692,240,108441,Win rest financial tree put impact.,1,drobna usterka
11693,228,108443,Business build region matter military group.,1,problem z silnikiem
11694,270,108445,Think about bill day whatever stuff prevent.,0,problem z silnikiem
11695,271,108447,Approach low phone after eat.,0,wykolejenie
