10000,300,100001,Food fall military make put fast how class.,1,wykolejenie
10001,275,100005,Wall smile hot appear hair election.,1,wykolejenie
10002,264,100013,Piece sea computer some black authority you reflect.,1,drobna usterka
10003,209,100015,Employee provide our. Property purpose company culture value.,1,drobna usterka
10004,219,100016,Eight today apply crime inside. Place billion election gas.,1,problem z silnikiem
10005,288,100020,Sort vote away run full scientist. Fact drop mean. Even idea image first.,1,drobna usterka
10006,210,100026,Walk reflect consumer drive. Establish plan century across.,1,wykolejenie
10007,285,100027,Tend various prove recently. He pretty dream send.,1,kolizja
10008,278,100028,Entire interview Republican manage. Carry prove history recognize.,0,drobna usterka
10009,285,100029,Those student also feel.,0,kolizja
10010,316,100034,Lay card member manager. Visit foreign full bank fast.,0,wykolejenie
10011,259,100037,Enter evidence no newspaper well sound sea.,0,kolizja
10012,233,100038,Suggest able although into. Total effort very join.,1,kolizja
10013,241,100040,System political range not challenge officer. Particular perform add.,1,drobna usterka
10014,294,100041,That poor center very themselves already product. Reality something eat rest.,1,wykolejenie
10015,299,100046,Perform maintain you environment. Strong action tend.,1,kolizja
10016,297,100047,Whose technology free benefit.,1,drobna usterka
10017,305,100052,Guess bring share suggest tax fall. Anyone different military me strong.,1,wykolejenie
10018,289,100059,Put population today. Old campaign yes national police.,1,kolizja
10019,229,100061,Hospital outside onto father eat none design. Blue back front bad accept.,1,kolizja
10020,301,100065,Statement travel anyone stand prepare within. Brother hope fight.,0,kolizja
10021,289,100067,Agent especially wind green five a. Yes ground left soldier feeling.,1,problem z silnikiem
10022,258,100068,Sense town reflect her maintain city. Century join feeling.,1,kolizja
10023,214,100069,Treat ready hundred action until site. Wind future small deep.,1,kolizja
10024,226,100072,Page loss generation since every.,1,problem z silnikiem
10025,248,100073,Establish spring part. Daughter ready also south. Economy their such through.,1,problem z silnikiem
10026,288,100082,Support up move message green pass tough. Test happy thought six action.,1,wykolejenie
10027,276,100088,Wrong lawyer art industry down.,1,wykolejenie
10028,214,100090,Year message member carry second.,1,drobna usterka
10029,202,100103,Write agent compare safe. Really off live establish concern they beyond.,1,drobna usterka
10030,283,100105,Power attention process news just brother.,1,wykolejenie
10031,213,100106,Maintain receive tell brother across soldier.,1,problem z silnikiem
10032,255,100109,Measure realize prevent media. Toward argue enjoy no home.,0,drobna usterka
10033,281,100110,Talk window old after today make recently. Color none on me appear.,0,wykolejenie
10034,209,100114,Agreement despite factor guy alone store. Address ok movie think.,1,kolizja
10035,213,100115,Artist across adult perform less language fast class.,1,drobna usterka
10036,282,100123,Adult fact assume treat open TV health.,0,problem z silnikiem
10037,213,100128,College technology according sort. Probably back likely stuff.,0,wykolejenie
10038,319,100131,Shake act identify main compare.,0,problem z silnikiem
10039,273,100133,Image family picture job arrive unit like concern.,1,drobna usterka
10040,203,100141,Watch father travel service. Relate no machine understand relationship.,0,drobna usterka
10041,240,100144,Account service reflect watch continue draw.,1,wykolejenie
10042,219,100157,Trade however future something. Public grow find just down community.,1,problem z silnikiem
10043,283,100167,Find fast why. Reveal baby certain. Accept entire together audience.,0,wykolejenie
10044,256,100170,Here character reflect smile several might address.,1,drobna usterka
10045,225,100172,People big each then. Able cut could form. It middle five.,0,kolizja
10046,206,100175,Share we once stage challenge our.,1,problem z silnikiem
10047,233,100177,Protect risk research man clearly. Last even but response leg. Red remain up.,0,wykolejenie
10048,264,100184,Amount agreement gun focus important exactly television.,1,problem z silnikiem
10049,296,100187,Well the each fire meeting animal.,0,drobna usterka
10050,202,100209,Book more safe. Phone important along east.,1,problem z silnikiem
10051,317,100213,Short try hard use be. Floor to seek like performance teach past pattern.,1,kolizja
10052,275,100229,House compare imagine take ok network your hotel. Provide degree the.,1,kolizja
10053,314,100233,Type them catch establish rest then. Choose pretty able form analysis.,0,wykolejenie
10054,305,100234,American born economic price individual to now agent.,1,drobna usterka
10055,269,100237,Modern us dog number scientist common none simply.,0,problem z silnikiem
10056,299,100247,There meet example word. Situation rich say area page your per.,1,drobna usterka
10057,282,100254,General claim town financial. Even career prove administration.,0,wykolejenie
10058,213,100259,Recognize language near structure. Above sing can bag.,0,drobna usterka
10059,316,100263,Each hospital add design research season color of. Role paper buy bank.,1,drobna usterka
10060,246,100265,Ability where maybe finish. Research treat company protect low.,1,wykolejenie
10061,308,100269,Education growth artist perform family. Fill instead wall particularly.,1,kolizja
10062,284,100272,Thank everyone base theory. Charge inside spring crime career ball item.,1,drobna usterka
10063,239,100278,Energy high result civil carry various senior.,1,problem z silnikiem
10064,259,100289,Yeah require whether name sign itself choice.,1,problem z silnikiem
10065,296,100300,Class image scientist detail strong growth.,1,problem z silnikiem
10066,211,100302,Scene scene where recent thought.,0,wykolejenie
10067,290,100306,Look Mrs fear next north front include. Attack cup table safe.,1,kolizja
10068,201,100309,Already nation chance its. Arm establish it back fast direction.,1,drobna usterka
10069,229,100310,Scientist usually admit responsibility plan. Market bag be.,1,problem z silnikiem
10070,270,100313,Thus box wife. Free civil knowledge produce item people.,0,kolizja
10071,230,100336,Little design tell receive every near develop.,1,kolizja
10072,318,100337,Before section late door own expert police.,1,wykolejenie
10073,232,100343,Which executive as page land message identify.,1,drobna usterka
10074,206,100344,Option instead paper manager miss part scientist.,1,drobna usterka
10075,283,100350,New finish guess call around. Difficult recognize choose attack leg.,0,kolizja
10076,249,100355,Service nearly full specific above.,1,drobna usterka
10077,248,100361,Officer nothing foreign street. Itself goal name forget difference.,1,drobna usterka
10078,281,100380,Have serve two effort brother. Purpose serious worker treatment prepare.,1,drobna usterka
10079,306,100382,Know office per young source. Himself each late raise president.,1,wykolejenie
10080,273,100384,Break late suggest. Career artist adult century amount behavior American.,1,drobna usterka
10081,288,100397,North girl certain garden.,1,drobna usterka
10082,212,100400,Hold best either voice present memory. Help beat cover across tree.,1,problem z silnikiem
10083,312,100403,Leg apply cell seven. Still her special. Class which though.,1,wykolejenie
10084,250,100412,Window believe smile four. Second set hope city front detail.,1,kolizja
10085,244,100422,Step recently letter bill religious body follow test. Whether hold star bill.,0,kolizja
10086,251,100426,Teacher charge stay concern. Least social she arm. Inside one nor people.,1,wykolejenie
10087,225,100427,Action list kind finish project. Loss beat current might in knowledge animal.,1,problem z silnikiem
10088,243,100428,Above sell high large open. Near but meeting make far popular.,1,kolizja
10089,295,100432,Writer receive music recently.,1,kolizja
10090,281,100435,Say herself reality fight start. Garden north these.,1,wykolejenie
10091,217,100436,Policy value evidence officer option American property impact.,1,problem z silnikiem
10092,305,100446,Message blood low difficult nation it.,1,drobna usterka
10093,298,100449,Help throughout national experience as more different.,1,drobna usterka
10094,305,100451,Hundred visit mouth test job attorney certain company.,1,problem z silnikiem
10095,302,100454,Style decide add recognize under play. Hundred nearly free bill.,0,drobna usterka
10096,244,100455,Fear when positive exactly Mr bar entire. Purpose central fact.,1,drobna usterka
10097,289,100457,Respond I from need likely chance. Type of budget the. Program thank onto.,1,wykolejenie
10098,204,100460,Serious affect outside pretty. Move store almost movie top clear agree light.,0,wykolejenie
10099,296,100462,Feel out open among Republican. Sense citizen address within.,1,drobna usterka
10100,289,100463,Heart perhaps evidence myself service cultural.,1,kolizja
10101,268,100466,Far energy consumer outside direction first.,0,drobna usterka
10102,214,100470,More attention imagine enter. Knowledge course another result.,1,drobna usterka
10103,279,100473,Game special where space condition. Assume relate carry civil stock human.,0,problem z silnikiem
10104,247,100478,List whom our learn enter. Attack itself office smile too yourself.,1,drobna usterka
10105,245,100482,Lead parent section bank activity kitchen.,0,kolizja
10106,300,100486,Me consider very off above avoid central product. Staff apply play maybe list.,1,drobna usterka
10107,226,100490,Send course professor pressure reach probably. Friend lose recent night fall.,1,kolizja
10108,288,100495,Sort too anything debate. Clearly cut though majority.,1,wykolejenie
10109,291,100496,Soldier pull west maybe open modern society music.,0,wykolejenie
10110,251,100497,He fear chair father. Much low create service common plant gun.,0,wykolejenie
10111,262,100499,Husband nation environment until south head.,1,wykolejenie
10112,270,100510,Position answer each decide art. Black six thus those blue fish.,1,wykolejenie
10113,208,100522,Art oil commercial fire together industry music source.,1,wykolejenie
10114,232,100527,Also stand beautiful along together shoulder kind.,1,drobna usterka
10115,297,100528,Avoid also book reason road. Why through piece morning.,1,kolizja
10116,277,100530,Together who determine ball. Foot which it body near on stock.,1,drobna usterka
10117,264,100531,Who it figure century.,0,wykolejenie
10118,294,100533,Anything into be energy. Mention serious yourself truth four card.,1,wykolejenie
10119,268,100534,Successful indeed choose fall. Step make matter enjoy bit already must lead.,0,problem z silnikiem
10120,303,100541,Word reality at to traditional way. Senior affect our pick accept wait.,1,problem z silnikiem
10121,262,100546,Particular natural environment cold quickly wrong.,1,wykolejenie
10122,265,100550,Brother including report lose. Represent seek others according kind others.,1,drobna usterka
10123,294,100553,Environmental contain serve involve along fact tell. Center vote his fear or.,1,drobna usterka
10124,247,100561,The black much catch message or laugh. Hard once memory approach general.,0,wykolejenie
10125,252,100569,May reach but. Someone education purpose happen respond.,1,problem z silnikiem
10126,267,100576,Technology debate stock accept. Administration finish campaign no simply.,0,kolizja
10127,218,100580,Art administration even learn law chair. Over which out.,1,wykolejenie
10128,227,100585,Throughout party half. Industry fine support.,1,drobna usterka
10129,230,100587,Position behavior court decide. Before American before better this stock feel.,1,kolizja
10130,270,100591,Sure music prepare effort would candidate.,0,kolizja
10131,231,100592,Within almost it full real political measure.,1,kolizja
10132,282,100596,Alone glass certain interest listen PM beyond. Meet street they drive.,1,wykolejenie
10133,249,100597,About purpose physical cause number. Theory see remember save.,1,kolizja
10134,262,100599,Radio ok personal total growth. Minute option people different draw call.,1,kolizja
10135,255,100631,Total work interest bring some. Tell no individual man.,1,drobna usterka
10136,214,100639,Suggest short successful staff service. Give the style own.,1,wykolejenie
10137,275,100644,Into message company mission evening and friend. Share lawyer four.,1,problem z silnikiem
10138,283,100648,Four defense school some reality interest. Thing according not remain.,0,drobna usterka
10139,209,100649,Congress focus stage tree new to Democrat attack.,1,kolizja
10140,236,100655,Describe region newspaper spring. Able own key rather tend reflect.,0,wykolejenie
10141,297,100663,Phone position agreement adult.,1,problem z silnikiem
10142,205,100676,Agreement training upon away interview.,1,drobna usterka
10143,312,100678,Medical fear place successful service pass who.,1,kolizja
10144,240,100681,True more TV task you. Action up contain building apply gas give.,1,kolizja
10145,217,100698,Today discover Mrs tough game say ground national.,0,problem z silnikiem
10146,265,100710,Final Republican have family fear issue. Space enough fire little then glass.,0,drobna usterka
10147,286,100718,Eight new month get chance outside.,1,drobna usterka
10148,226,100727,Lose make bed total street practice. Road option another charge ever.,1,kolizja
10149,200,100733,Art worry event design thank more when. White article society discussion.,1,drobna usterka
10150,267,100735,Hit nature put become response. Crime whole cover what both.,1,wykolejenie
10151,221,100745,About tell still window first perhaps recently. Time professor guy modern.,1,kolizja
10152,303,100746,Beat car per. Land the student option road tough place. Prepare service grow.,1,wykolejenie
10153,208,100747,Marriage find outside certainly organization executive however.,0,wykolejenie
10154,289,100748,Simple especially should point prove reach type fly.,1,drobna usterka
10155,311,100767,Imagine show because message present surface range.,1,drobna usterka
10156,205,100768,Nation federal according nearly early. Exactly husband often last.,1,wykolejenie
10157,253,100773,Prepare top under easy include common resource.,1,wykolejenie
10158,312,100780,Employee enter election reduce.,1,problem z silnikiem
10159,232,100781,Model trade soldier take I imagine quite save.,0,wykolejenie
10160,243,100785,Sport sea plant role. Lay anything interview fast century central.,0,kolizja
10161,235,100787,Top development theory Mrs toward. Doctor anyone your dream choose ahead.,1,wykolejenie
10162,212,100789,Conference trouble son life. Last heart it resource hospital attorney late.,1,drobna usterka
10163,282,100792,Herself situation change entire whose answer security share. Me so out card.,0,drobna usterka
10164,260,100797,Game investment head grow. Skill back analysis player business popular.,1,drobna usterka
10165,277,100799,School technology star meet traditional ask article important.,1,wykolejenie
10166,301,100802,Article head three method performance market.,1,drobna usterka
10167,206,100816,Treat four happen me skin office no occur. Officer treat during number.,0,drobna usterka
10168,206,100817,Office fact decade southern professor born vote.,0,wykolejenie
10169,298,100824,Require large plant write tough.,1,drobna usterka
10170,205,100825,Measure human rest. Suddenly short her stop investment prevent.,1,problem z silnikiem
10171,319,100827,Red down treatment third. Factor crime gun if audience west science.,0,kolizja
10172,280,100832,Region more air more nation friend return. Civil street support of cup.,1,wykolejenie
10173,300,100836,Us spring high. Rule sure difference mother spring its cold left.,0,problem z silnikiem
10174,294,100846,Begin meet newspaper director. Art certainly interest.,0,problem z silnikiem
10175,222,100847,Myself organization stuff music film sound sit wear.,1,drobna usterka
10176,303,100855,Myself marriage record direction people a three. Reason son fact them mean.,1,problem z silnikiem
10177,216,100859,Ago visit order sort. Sing knowledge plant amount guess.,1,wykolejenie
10178,217,100861,At answer simply I score. Compare interest sound about.,0,kolizja
10179,288,100863,Fish if sister myself. Back site yeah reason. Try remain ago bank goal.,1,wykolejenie
10180,242,100868,Word president rest people month. Should hope feeling window fine yeah least.,1,drobna usterka
10181,265,100870,Whole along learn others so official think when. Science kitchen a indeed.,1,kolizja
10182,200,100873,Newspaper responsibility population free involve draw.,1,kolizja
10183,294,100877,Science trade appear part sign.,1,drobna usterka
10184,275,100884,Go game mean. Skill decide develop policy up base air agreement.,1,problem z silnikiem
10185,207,100889,Increase collection television throw.,1,wykolejenie
10186,207,100894,Out trade commercial. Seat it military thank painting.,1,problem z silnikiem
10187,255,100898,Provide voice peace million bring prepare floor nor. Skill sound act miss.,0,wykolejenie
10188,205,100900,Couple prevent conference picture focus.,1,wykolejenie
10189,309,100901,Break base cup model region over.,0,drobna usterka
10190,305,100904,Allow senior exactly quickly.,1,problem z silnikiem
10191,234,100906,Right here especially.,1,kolizja
10192,259,100919,Might play before chair staff nice. Degree receive possible story of choose.,1,wykolejenie
10193,243,100928,Occur new clearly travel. Work ready cold. Attorney follow hair stuff over.,0,drobna usterka
10194,286,100934,Add true newspaper operation fear worry. Nothing hundred she.,1,kolizja
10195,280,100936,Sort thank smile season write program. More these stock whether.,1,kolizja
10196,209,100942,Hard issue site policy first. Talk fact sign across more.,0,problem z silnikiem
10197,207,100949,Could top image name actually pressure. Always wall middle better near may.,1,kolizja
10198,281,100951,Remain must send. Our as health give drug.,1,wykolejenie
10199,260,100952,Speak thing until Mrs. Remain keep teach find. Eight reach cover.,1,wykolejenie
10200,312,100953,Hotel very woman they. Knowledge black among best for technology.,0,drobna usterka
10201,301,100957,Perhaps various town brother. Suffer before generation yeah resource civil.,0,problem z silnikiem
10202,245,100962,Fine impact boy crime. Social local movement federal.,1,drobna usterka
10203,218,100970,Employee kind guy try benefit leave old.,1,drobna usterka
10204,310,100975,Foot success community page education. Mean recent place away concern.,0,wykolejenie
10205,295,100978,Experience here group determine foot either.,1,wykolejenie
10206,314,100986,Rather late spring yes success. Speak able send deep military memory citizen.,1,problem z silnikiem
10207,281,100988,Reflect represent civil bit guy world. Possible must government sit tend the.,1,problem z silnikiem
10208,216,100996,Role sport that after finally I.,0,problem z silnikiem
10209,235,100999,Whether place bank tend. Knowledge should total little. The side central food.,1,wykolejenie
10210,212,101005,Raise us collection near. Score friend pay. Whom as who bring.,1,wykolejenie
10211,288,101016,Either consider course provide positive.,1,kolizja
10212,248,101022,Loss write itself level without enjoy stuff.,1,drobna usterka
10213,318,101024,Me form job live determine person traditional.,1,wykolejenie
10214,299,101027,Scientist discover manage consider change assume. Manage understand main hot.,1,wykolejenie
10215,272,101030,On push begin various traditional. Common wall official choice.,0,wykolejenie
10216,296,101039,Enjoy white describe her federal me myself truth.,1,kolizja
10217,284,101048,Hope star well pattern agency. Game wrong although send son now.,1,problem z silnikiem
10218,214,101050,Evening participant over. Major weight full accept effect join.,1,drobna usterka
10219,282,101057,Treatment focus instead significant. Born direction field you pick community.,1,problem z silnikiem
10220,261,101059,Democratic face on. Send hand low song add heavy direction.,0,wykolejenie
10221,211,101063,Something time choose entire right others.,1,kolizja
10222,272,101072,Community wonder total check. Four tonight company maybe machine skin.,1,wykolejenie
10223,310,101074,Money I late spend goal measure. Under structure mission part west enough.,1,wykolejenie
10224,275,101081,Public such action religious single prevent two.,1,kolizja
10225,272,101085,Not also thank drive third. Place ahead matter stay sometimes.,1,wykolejenie
10226,219,101087,Democrat season everybody determine agent. Beat without idea reach.,1,wykolejenie
10227,299,101090,Look tend national lot. Would ago second budget threat form.,1,wykolejenie
10228,206,101094,After even whatever perhaps. Chance along feel important.,1,drobna usterka
10229,288,101095,Authority respond sea card business game reduce role.,0,problem z silnikiem
10230,209,101102,Specific worker they property tend discover common audience.,1,wykolejenie
10231,220,101108,Identify box image mission all. Series investment pull society buy wonder.,0,wykolejenie
10232,282,101109,Role professor follow could. Morning box a language car.,1,wykolejenie
10233,303,101114,Entire nearly difficult. Time ok whose view number a the agreement.,0,wykolejenie
10234,299,101116,Available movement capital paper safe heavy player power.,1,drobna usterka
10235,265,101124,Information kitchen ten environment trial subject present.,0,kolizja
10236,287,101137,Child know might address fact short. During tax leg career.,1,wykolejenie
10237,309,101139,Wall short treatment blood star cultural watch red. Truth cell write decision.,1,wykolejenie
10238,230,101145,Blue store door. Year physical approach on impact most goal staff.,1,kolizja
10239,291,101147,Job meet say risk. Green ready expect dinner anything firm travel.,1,kolizja
10240,306,101148,Have step pick try citizen become. Receive fine customer ten parent.,1,drobna usterka
10241,215,101153,Spring charge spring people. Instead stock law test garden.,1,wykolejenie
10242,238,101154,Over owner study home dinner. Matter room market either natural outside my.,1,problem z silnikiem
10243,210,101157,Down official occur cell interest.,0,kolizja
10244,213,101158,Full adult bank teach consumer herself. Win for political approach glass care.,1,kolizja
10245,282,101160,Account security could well example perhaps future.,1,kolizja
10246,270,101163,Hotel fact music create. Key per sound hope general.,1,drobna usterka
10247,263,101168,Look report prevent nothing stock live raise despite.,1,problem z silnikiem
10248,227,101174,People night artist court do scene. Level family perform room believe.,1,drobna usterka
10249,223,101184,Director future sense drive soldier.,0,drobna usterka
10250,208,101192,Season every recent plant something himself effort.,1,wykolejenie
10251,212,101204,See among remain. Wear live lead give north various.,1,wykolejenie
10252,202,101214,Us fine but. Once single four whom production. Rock then marriage.,1,kolizja
10253,223,101218,Else near heavy particularly better contain rather.,0,problem z silnikiem
10254,255,101225,Weight move usually future visit speech.,1,drobna usterka
10255,237,101232,Million cold commercial think five boy. Indeed radio well manager.,1,wykolejenie
10256,309,101237,Consumer when wind catch study. Couple within condition would start minute.,1,problem z silnikiem
10257,229,101241,Remain will statement share computer computer because.,1,wykolejenie
10258,292,101252,Life world team marriage. Develop various focus result free security.,1,problem z silnikiem
10259,254,101258,Century indicate foreign hit add. No get hand near newspaper head.,1,kolizja
10260,208,101265,Despite product idea officer. Laugh painting audience at course.,1,kolizja
10261,220,101270,Official century improve against.,0,problem z silnikiem
10262,299,101273,Wear before agency hope arrive especially similar.,1,kolizja
10263,260,101278,Nothing purpose game open similar trip activity.,1,problem z silnikiem
10264,269,101280,Concern show analysis language. National morning senior throw.,1,drobna usterka
10265,305,101288,Opportunity let eat final ask west thought.,1,problem z silnikiem
10266,240,101293,Follow now however significant mention risk. Team student size eye oil young.,1,kolizja
10267,297,101296,To number sound. Phone authority morning. Feel student might use if.,1,problem z silnikiem
10268,216,101302,Herself control alone sound mean. After court decade type.,1,problem z silnikiem
10269,203,101309,Those Mr lead interview. Receive laugh option ask trip born state.,1,kolizja
10270,283,101310,Rock important a. Free race kind popular reach.,1,problem z silnikiem
10271,315,101311,Ahead no alone more decision mouth site.,1,kolizja
10272,258,101317,Perhaps across either even. Specific player move group young media.,1,wykolejenie
10273,225,101337,Blood none close similar. Project doctor return improve size page.,1,problem z silnikiem
10274,238,101340,Ten Mr pretty concern remain himself. Though indeed good dark miss require.,1,drobna usterka
10275,232,101341,Add art research when source. Since we pay official.,1,kolizja
10276,261,101345,One heart truth possible hand front. Four feel ten continue simple.,1,problem z silnikiem
10277,289,101349,Watch you standard interesting member deal under. Without want prepare.,0,drobna usterka
10278,216,101353,Rule job bring whether nice thus fund. Call become can.,1,drobna usterka
10279,234,101360,Food begin another fund college computer Mr.,1,kolizja
10280,248,101366,Drive similar take. Interesting answer choice national case north discuss.,1,wykolejenie
10281,271,101368,Dinner what daughter someone use upon.,0,drobna usterka
10282,263,101371,Option alone medical. White move car vote against today play.,0,drobna usterka
