14524,279,122203,Upon response fine group finish choose.,1,drobna usterka
14525,256,122205,Prove task many bank PM. Soldier quite young finally list treatment.,1,kolizja
14526,244,122206,Under process help person myself clearly ready let.,1,drobna usterka
14527,252,122217,Country send international professional off single knowledge.,1,drobna usterka
14528,203,122219,Hot similar month test represent. Why eye attention idea.,1,drobna usterka
14529,256,122227,Task skin point there job weight. Interest peace despite matter.,1,drobna usterka
14530,317,122228,Thus usually stuff realize of Mrs defense. Local role key.,1,problem z silnikiem
14531,317,122238,Recently life skill year majority. My miss local entire believe.,1,problem z silnikiem
14532,315,122240,Investment go mind along. Will trip least expert window someone.,1,drobna usterka
14533,230,122241,Reason lose fish develop top data. Newspaper little phone yard but newspaper.,0,wykolejenie
14534,294,122242,When around computer pretty degree fall.,0,drobna usterka
14535,316,122246,Wall half type language. Ever yeah risk station.,0,wykolejenie
14536,308,122249,Difficult article majority oil. Under glass treatment toward.,0,wykolejenie
14537,316,122258,Religious level defense defense bar.,0,drobna usterka
14538,295,122259,Reality subject nothing ask will good. Personal end computer teacher hear.,1,wykolejenie
14539,256,122269,Move several world quality. Appear peace lay beautiful fine century research.,0,drobna usterka
14540,313,122278,Teach news pattern. Drive total amount kitchen exist. Big floor set home.,0,drobna usterka
14541,229,122281,Require low difficult effect camera ground city.,1,problem z silnikiem
14542,294,122282,Sense pattern effect stop traditional another.,1,problem z silnikiem
14543,229,122297,Page debate again city eat base idea. Space option space.,0,problem z silnikiem
14544,266,122298,Month school father create almost.,1,kolizja
14545,299,122304,Pattern alone worker population.,1,wykolejenie
14546,231,122325,Collection level people. Number look glass century whose middle.,0,drobna usterka
14547,214,122329,Position figure base. Perhaps safe medical.,1,problem z silnikiem
14548,222,122340,That country true fast however. Wonder game industry child.,0,problem z silnikiem
14549,284,122341,Mr clearly see PM. Growth true fire long. Everybody eight material all.,0,drobna usterka
14550,241,122345,Bad seven among later all. Small matter various require involve business go.,1,drobna usterka
14551,260,122357,Address learn nature billion indicate. Design mind far include owner.,1,drobna usterka
14552,249,122360,Deal management fight happy. Off strong move point away do.,1,drobna usterka
14553,212,122367,Though often action. Season amount until indeed. When phone speech take.,1,problem z silnikiem
14554,205,122370,Much some national pick. Memory lawyer of seem. Front place feel million.,1,kolizja
14555,232,122383,Despite age pick. Else painting remember media discussion which her site.,1,drobna usterka
14556,242,122386,College none commercial most. Much company appear themselves hot bed.,1,drobna usterka
14557,213,122391,Mother policy possible similar would. Environment sport mention difficult.,1,problem z silnikiem
14558,239,122398,Best toward language beat film leave right wonder.,0,wykolejenie
14559,272,122404,Them choice quality personal bring into. Science because by forget sound area.,0,kolizja
14560,246,122416,Civil college like maybe. Serve result fact star social teacher.,1,wykolejenie
14561,288,122423,Tell matter television phone. Deep common reason box.,1,problem z silnikiem
14562,317,122424,Marriage ball list together American interesting his.,1,problem z silnikiem
14563,297,122425,Work sound start hit black wait PM. Free phone benefit down.,0,wykolejenie
14564,212,122429,Worry leave house. Election customer consider leader piece culture wife.,1,problem z silnikiem
14565,244,122430,Story machine before personal past figure PM. And benefit lay.,0,kolizja
14566,244,122432,Suffer try song that hear occur black. Game discuss hope finish.,1,drobna usterka
14567,241,122433,Side true international beat him.,1,kolizja
14568,305,122435,Within our total year thought.,1,wykolejenie
14569,247,122440,Plan camera imagine machine board. Degree method city develop subject.,1,kolizja
14570,227,122445,Lot everything health someone with present.,1,problem z silnikiem
14571,237,122455,Ago easy remember even learn sit sing.,1,wykolejenie
14572,203,122456,Fund call even economic. Politics hope area skill sound.,0,drobna usterka
14573,288,122460,Add PM Republican face. Less turn involve which customer wear alone.,0,problem z silnikiem
14574,241,122461,Leave fear relationship issue. Half lead time. Sense brother billion.,1,drobna usterka
14575,275,122471,Public nature easy. Area machine entire. Meeting under stay crime its thing.,1,drobna usterka
14576,289,122475,Yes century growth order. Place organization describe woman wish stock seek.,1,wykolejenie
14577,280,122481,At him example attention check hair popular.,0,kolizja
14578,271,122490,Difference help effort detail. Claim building thus here.,1,kolizja
14579,311,122492,Operation learn debate institution.,1,kolizja
14580,251,122495,Scene between audience middle especially treat.,0,drobna usterka
14581,288,122496,Sense public break north support.,1,drobna usterka
14582,208,122500,Agreement ball choice compare maybe charge. Hold line thought impact.,1,kolizja
14583,228,122501,Check her newspaper near build. No describe life subject.,1,kolizja
14584,282,122506,Bad on heart offer change. Year machine young along the reduce.,0,drobna usterka
14585,225,122511,Draw training visit play return summer source. Money whose big than store.,1,kolizja
14586,208,122518,Let bed financial score price future relationship.,1,wykolejenie
14587,266,122525,Participant physical television try. Rather life American.,0,problem z silnikiem
14588,276,122529,Good laugh billion audience vote politics tend. Season soon necessary soldier.,0,drobna usterka
14589,272,122530,Image market concern word memory father no.,1,wykolejenie
14590,275,122531,Involve as book available instead. My painting miss them.,1,kolizja
14591,304,122537,Appear run act very. Together imagine enter four success ok suffer whom.,1,problem z silnikiem
14592,284,122543,Station season allow game.,1,kolizja
14593,273,122545,Car road different. Agreement despite chair reality agent.,0,wykolejenie
14594,316,122555,Sure oil old smile. Face oil sea old international.,1,drobna usterka
14595,241,122563,See actually free many wish field time avoid. Size add too ok along.,1,wykolejenie
14596,297,122567,Physical west little cut. Us card language art not.,0,problem z silnikiem
14597,226,122576,Describe very able subject woman third eye.,1,drobna usterka
14598,203,122578,Class enter trouble international.,1,problem z silnikiem
14599,269,122580,College benefit fly wear method weight. Responsibility law manager democratic.,1,wykolejenie
14600,255,122582,Age commercial guy kitchen herself measure generation. And strong woman.,1,wykolejenie
14601,309,122585,Interesting thus notice tonight friend can. Talk still eight however as.,1,drobna usterka
14602,200,122586,Series agent never against. Price home bank until.,1,problem z silnikiem
14603,251,122587,Several country how room itself these mother. Indeed boy government listen.,1,drobna usterka
14604,254,122595,Only trade toward his cause. Write TV before attention owner.,1,problem z silnikiem
14605,235,122599,Myself arm plan toward marriage over. Attention challenge six pick.,1,wykolejenie
14606,217,122604,Economy recent public. Lawyer that generation thank.,0,wykolejenie
14607,317,122607,Shake kid summer to know nice have local. Lawyer skill drive return.,0,problem z silnikiem
14608,256,122608,Education reach west off real quickly. Audience fact son need much.,1,drobna usterka
14609,273,122620,Consider discussion recent mention production blue institution.,1,drobna usterka
14610,246,122627,Herself between vote something knowledge especially. With eat close.,1,wykolejenie
14611,205,122628,On identify level heart very. Wear person we. Group Congress media hour.,1,kolizja
14612,252,122629,Catch bit watch myself. He them fast husband customer.,0,problem z silnikiem
14613,301,122631,Themselves culture born mother white others.,1,kolizja
14614,289,122637,Identify a beyond customer consider other bad note.,0,problem z silnikiem
14615,207,122649,Ahead main finally set.,0,problem z silnikiem
14616,266,122654,Thus gas lead prepare. Toward test already.,0,drobna usterka
14617,249,122655,Recently challenge car personal.,0,wykolejenie
14618,211,122656,Stand others sell board. Form together artist relationship exist stand might.,1,kolizja
14619,211,122677,Dark turn despite between right population often sometimes.,1,kolizja
14620,302,122688,Why few group phone among tonight ok.,1,drobna usterka
14621,223,122690,Sound should much shake but spend ask. Reach interview draw keep.,1,problem z silnikiem
14622,219,122695,Air allow themselves their national direction sister. Boy memory year both.,0,kolizja
14623,202,122704,Pass easy best human. Street quickly follow collection she company.,0,kolizja
14624,319,122705,Explain receive within bad have else last. Second at dinner sell seven out.,1,wykolejenie
14625,276,122715,Up administration over note audience notice. Surface per physical way provide.,1,drobna usterka
14626,303,122719,Red forward summer stay relate executive force.,0,problem z silnikiem
14627,253,122724,Line live represent government. Think activity interview.,0,kolizja
14628,219,122730,The type reflect laugh. List shake simple front arm base relate.,1,problem z silnikiem
14629,235,122733,Century staff able travel wait discuss. Specific able drop gun place most.,0,wykolejenie
14630,232,122735,Say whatever relate career. Our natural attack agency step cut seem ball.,1,problem z silnikiem
14631,201,122739,Trouble east physical enjoy per suggest.,1,wykolejenie
14632,311,122742,Local class yard analysis imagine wrong easy.,1,kolizja
14633,213,122744,Young finally whom I. Body else small difference campaign both describe.,1,kolizja
14634,236,122756,Much song my. Available scene hotel Mrs lay water dinner.,1,wykolejenie
14635,265,122762,Instead evidence various concern city bar. Bill compare ago recently.,0,problem z silnikiem
14636,252,122764,Service put nor within car opportunity common heavy.,1,drobna usterka
14637,232,122768,Difficult early forget ground staff. News fight law.,0,wykolejenie
14638,230,122774,Benefit hand spend significant system section. Crime able thing peace contain.,0,wykolejenie
14639,275,122781,Employee environment believe either player.,1,drobna usterka
14640,249,122782,Less contain experience public. Word product firm itself.,1,kolizja
14641,265,122788,Cup approach see themselves. Condition contain kind right including.,1,kolizja
14642,222,122790,Party scientist commercial add. Treatment thing apply drop couple.,1,wykolejenie
14643,256,122794,Staff single TV remember nearly forward.,1,problem z silnikiem
14644,232,122795,Or road couple. Him religious degree study president. Identify father nature.,0,problem z silnikiem
14645,291,122803,National under up computer discuss.,1,problem z silnikiem
14646,311,122805,Sometimes film trouble animal past Mrs.,0,problem z silnikiem
14647,297,122807,View focus phone evidence training.,0,wykolejenie
14648,299,122808,Ago many quality maybe. Perform option forward.,1,kolizja
14649,219,122813,Single here tax. Above message against and range third tree.,0,kolizja
14650,313,122816,Service management north often scientist morning.,1,drobna usterka
14651,272,122821,Car control room outside affect.,1,wykolejenie
14652,211,122826,Miss through also world financial.,0,problem z silnikiem
14653,274,122830,Woman list employee nice room.,0,problem z silnikiem
14654,264,122835,Price item certainly play middle party prepare.,0,drobna usterka
14655,200,122839,Foot keep discuss table. Hundred next institution where.,1,drobna usterka
14656,217,122843,Space leg medical dream. Fine them spring stand industry finish.,1,kolizja
14657,243,122857,Apply natural program experience kitchen action yes director. Social son test.,1,drobna usterka
14658,279,122858,Past present thing. Best make future western attack. Eye stand police allow.,0,drobna usterka
14659,203,122861,Run mind put head guess cup century tell. Past southern research unit assume.,1,kolizja
14660,279,122869,Music itself machine father finish why commercial. More nearly couple if.,1,wykolejenie
14661,251,122873,Rather follow state. Per represent perform career total human economy.,1,problem z silnikiem
14662,259,122884,Decide especially gun as. Everything speak good power want service study.,0,drobna usterka
14663,239,122889,Drop check certainly support human. Huge event out.,0,drobna usterka
14664,212,122894,Leave education from type once simple support.,1,drobna usterka
14665,222,122904,Question election few group. Between however note appear blood democratic.,1,wykolejenie
14666,311,122907,Walk politics audience even from happen at at.,1,kolizja
14667,226,122909,A poor middle believe avoid. Writer trade part indicate.,0,problem z silnikiem
14668,259,122912,Hair time wear worry. Night eat knowledge hit understand end.,0,drobna usterka
14669,315,122921,Student continue partner better late. Quickly base chance fall family.,1,kolizja
14670,286,122926,Sure attack star allow growth. Meet night remember inside lay contain.,1,drobna usterka
14671,255,122928,Interest again surface bit occur clear heavy. Onto message agency.,1,problem z silnikiem
14672,317,122931,Side contain ask Republican ground couple.,0,problem z silnikiem
14673,258,122933,Movement amount according marriage between out. Time fight across.,1,drobna usterka
14674,213,122938,Suffer product view. Radio industry hundred.,1,problem z silnikiem
14675,299,122939,Very significant eat. Itself American drug citizen record.,0,drobna usterka
14676,299,122941,Painting reduce find use contain inside. Process step executive ground book.,1,kolizja
14677,264,122943,Clearly grow generation address. Gun condition piece step vote author edge.,1,drobna usterka
14678,310,122946,Development book fly sit three establish worker.,1,problem z silnikiem
14679,309,122954,At war against hit wish exactly. My success say entire check family.,1,drobna usterka
14680,303,122965,Reach political shoulder their. Realize want compare.,1,problem z silnikiem
14681,257,122967,Pull score coach will station energy edge. Language wind class thousand.,0,kolizja
14682,254,122977,Hear line call scene money management knowledge.,1,drobna usterka
14683,295,122989,Tv direction parent data course.,1,kolizja
14684,313,122991,Minute education laugh fly grow country.,1,problem z silnikiem
14685,291,122996,Write act military develop compare.,0,wykolejenie
14686,281,123007,Choose drive they put before. Sing purpose record cell true.,1,wykolejenie
14687,223,123011,Create and always money. About begin get station question successful.,1,kolizja
14688,230,123021,Economy add myself long measure listen serve.,1,kolizja
14689,282,123022,Worry certainly address although cold. Born choose where.,1,problem z silnikiem
14690,273,123027,Experience author list already mission social fight everybody.,0,drobna usterka
14691,316,123029,Way toward market card home run. Act current candidate nation. Bag then team.,0,kolizja
14692,265,123033,Performance difference staff prepare. Expert reach movie pick around child.,1,kolizja
14693,206,123035,Produce good animal. News upon art us. Can opportunity meet eye.,1,kolizja
14694,219,123039,Table whole face writer each international discuss.,1,problem z silnikiem
14695,313,123046,Long kitchen different help set I. Go instead shoulder week since.,1,drobna usterka
14696,301,123050,Model quickly deep attorney support economy difficult live. Exist this argue.,1,wykolejenie
14697,239,123057,Teach strong health. Anyone perhaps health. Play grow guy environmental.,1,drobna usterka
14698,304,123058,Production culture often gas forward. Quickly car president.,1,drobna usterka
14699,277,123064,Training future man. Any hand many blue without wonder consumer.,1,wykolejenie
14700,224,123071,Add wear company truth. Course treat computer million trouble down rule.,1,wykolejenie
14701,311,123074,Once alone perform chance rich whatever kid. Continue never by with nice.,1,drobna usterka
14702,271,123077,Military matter challenge certain on nature.,1,kolizja
14703,319,123087,When including relate human. Author ground list stock sister court.,1,drobna usterka
14704,226,123089,Piece every someone test computer should. Group small research watch.,0,kolizja
14705,201,123090,Last take democratic see director particular recently.,1,kolizja
14706,246,123091,Take people article. Stay star product industry account.,1,wykolejenie
14707,283,123096,People both adult training shake seem community.,1,wykolejenie
14708,226,123102,Various too find candidate manager foot case.,1,drobna usterka
14709,231,123112,Establish red even nation task send morning.,0,problem z silnikiem
14710,209,123117,Population necessary safe rate money. Animal strategy nice night.,0,kolizja
14711,289,123129,Local wonder these agent beyond record. Quickly listen history person yard.,1,problem z silnikiem
14712,318,123131,Sometimes difficult defense example condition even.,1,problem z silnikiem
14713,233,123132,Situation project spring particular end state.,0,kolizja
14714,306,123133,Sort two forget they adult environmental. Next total least hand whose.,0,problem z silnikiem
14715,283,123134,Energy now level throughout moment reduce. Some least once year.,0,drobna usterka
14716,288,123141,Water appear single. Sit she body hope bar national.,0,drobna usterka
14717,281,123145,New tonight either responsibility adult.,1,drobna usterka
14718,309,123152,Join tend order fight put age. Speak evidence pressure good.,1,problem z silnikiem
14719,210,123153,Majority prepare kind present size require left.,1,kolizja
14720,218,123155,Box couple company both make bed. Page result nor behind election same.,0,problem z silnikiem
14721,240,123160,Great popular discover performance bar seek. Seem by remain occur provide.,1,kolizja
14722,273,123164,Everyone either easy exist set include hot.,0,drobna usterka
14723,263,123165,Whether memory last treatment oil eye trouble.,0,kolizja
14724,219,123167,Fund low carry deep training industry. Name nearly trade entire station paper.,0,problem z silnikiem
14725,281,123179,Miss opportunity girl any. Sometimes voice line near specific take help.,0,kolizja
14726,298,123181,Shoulder last late almost town role might foot. Church consumer plant your.,1,wykolejenie
14727,204,123182,Ahead year administration where nation.,1,wykolejenie
14728,277,123186,Mrs detail operation spring we popular area.,1,problem z silnikiem
14729,295,123188,Manager mother government many. Line not seem in feel owner same foot.,1,kolizja
14730,245,123205,Feel foreign station new official. Minute skill travel artist student.,1,problem z silnikiem
14731,239,123206,Style investment power character. Early provide dinner senior election.,1,drobna usterka
14732,257,123236,Everyone democratic six news sometimes our various.,1,problem z silnikiem
14733,291,123240,People human attention central. Owner draw only outside feel alone million.,0,drobna usterka
14734,253,123241,Current whole low before.,1,wykolejenie
14735,238,123242,Have majority find coach. Event memory magazine computer discuss white.,0,problem z silnikiem
14736,249,123249,Research clear someone do upon mention.,0,drobna usterka
14737,305,123251,Agree gun best project something cause animal.,1,kolizja
14738,246,123258,Buy move pull job work thank. Especially his community.,1,kolizja
14739,288,123266,Take audience account require. Entire keep resource prepare fast poor.,1,problem z silnikiem
14740,265,123268,Just between hotel collection. Look stay blue election lead foreign treatment.,0,wykolejenie
14741,256,123269,Force though hot technology example.,1,drobna usterka
14742,250,123278,Together fear third through few responsibility citizen.,1,wykolejenie
14743,251,123282,Improve fund like charge open. Other deal kitchen.,1,wykolejenie
14744,268,123293,Big important down professor. Not color song response history threat.,1,drobna usterka
14745,225,123297,Person without study including fish relationship.,0,problem z silnikiem
14746,229,123301,Lose arrive whatever need wait former.,1,wykolejenie
14747,261,123306,Study husband single foreign we toward.,1,kolizja
14748,242,123309,Project bank last because approach woman down Democrat.,1,wykolejenie
14749,257,123313,Lead necessary move my drug. Stock magazine reach worry of minute represent.,1,drobna usterka
14750,273,123315,Suddenly sister task case. Identify hour final before treat conference.,1,drobna usterka
14751,316,123321,Form respond a ten perhaps. Write admit card while old seven.,0,drobna usterka
14752,258,123335,Know create protect once what board almost.,1,wykolejenie
14753,318,123338,Throw artist service force north dark.,1,wykolejenie
14754,317,123341,Approach mind fund fall include specific point. Issue home peace seek drive.,1,wykolejenie
14755,250,123342,Student store yet hotel.,1,wykolejenie
14756,223,123345,Politics evening gas seven. Of city region.,1,drobna usterka
14757,231,123347,Federal why action across. About those seven.,1,drobna usterka
14758,236,123349,Who size join be build system according example.,1,kolizja
14759,238,123353,Find increase general just each fire today.,1,drobna usterka
14760,308,123361,Decision writer finish instead ball company nothing.,1,kolizja
14761,305,123362,Every change picture indicate. Could want happy sometimes act personal.,1,wykolejenie
14762,268,123363,Environment hospital five people technology interesting.,0,problem z silnikiem
14763,282,123370,Best wind individual though. Believe fire look animal.,0,kolizja
14764,284,123373,Home alone simple benefit attorney expert bill.,1,kolizja
14765,235,123380,Movie movie focus time could record. Traditional job evening how employee.,1,drobna usterka
14766,214,123392,Animal outside recent. Idea after her leg thank despite local former.,0,kolizja
14767,238,123394,Walk director discussion drive. Rate avoid theory rise mouth little.,1,kolizja
14768,255,123398,Across but wrong everything sell be reality. Kind movie contain quality.,1,problem z silnikiem
14769,243,123407,Science race evening most. Kind amount same two beautiful very.,1,problem z silnikiem
14770,205,123410,Certainly trip only television themselves seek positive.,0,kolizja
14771,256,123412,Word month attention act box wait special party.,1,wykolejenie
14772,289,123425,Tonight raise good media mind kid meet. Organization trip treatment him.,1,drobna usterka
14773,301,123430,Contain simply usually chair. Concern ahead month morning.,0,problem z silnikiem
14774,251,123434,Whole everybody teach quite hit. Response drug big rich certainly hotel.,1,kolizja
14775,308,123442,Argue necessary our white. Everybody pick ask card. Too vote technology.,1,problem z silnikiem
14776,249,123450,Ball rise fill. Pick student brother kind right. Since firm need civil.,0,drobna usterka
14777,224,123458,Director bank avoid population support lose center.,1,problem z silnikiem
14778,288,123460,Population rest would everything eye attack.,0,problem z silnikiem
14779,208,123462,Dog exist anything enough maybe. Carry grow food it American school race.,1,kolizja
14780,261,123467,Return too their place go bed. Morning safe boy away.,1,kolizja
14781,262,123469,Commercial these teach food manage score sit.,1,kolizja
14782,204,123475,Force kind ready customer. Hard soon represent. Recently age join art fear.,0,wykolejenie
14783,294,123478,Right course job reflect. Wait skill real line garden.,1,drobna usterka
14784,219,123479,Notice economic thousand art lot heart in. Audience say ability land ahead.,1,kolizja
14785,212,123486,Rise support clearly individual special join.,1,kolizja
14786,300,123490,This hand add area risk room chance. Idea style evening.,0,drobna usterka
14787,247,123491,Six body company dog way. Really project than not front bed outside however.,1,problem z silnikiem
14788,281,123504,Score choice that then pattern. Produce skill still voice executive.,0,kolizja
14789,286,123514,Such economy light hot. Build conference sure direction yet home brother.,1,drobna usterka
14790,224,123515,Chance manage check. Finish Democrat movement year hit.,1,wykolejenie
14791,222,123517,Debate couple single open theory talk. Evening not still stuff once money him.,1,wykolejenie
14792,204,123523,Defense piece read free if.,0,wykolejenie
14793,257,123525,Entire discuss heavy risk. Guess force end degree.,0,wykolejenie
14794,298,123536,Maintain make push check. Full entire education life create everybody mother.,0,wykolejenie
14795,272,123542,Really card list manage American agent.,1,wykolejenie
14796,241,123546,Hair teach laugh simply. Meeting attack space color radio.,1,wykolejenie
14797,265,123553,Far mouth heavy sort girl method. Eat character much central matter smile.,1,drobna usterka
14798,207,123554,Whole me nor chair read town land view. Table most line easy.,0,wykolejenie
14799,227,123562,Network staff friend.,1,wykolejenie
14800,213,123570,Very necessary field after.,1,wykolejenie
14801,302,123574,Alone garden woman fact garden will north. Leader worry yeah.,1,wykolejenie
14802,204,123582,Wife position field region always choose may.,1,kolizja
14803,237,123583,Blood cut answer study. Throughout degree option.,1,drobna usterka
14804,296,123589,Wife ground somebody line individual value particularly.,1,problem z silnikiem
14805,230,123591,Surface I hotel maintain. Draw range traditional look should source.,0,drobna usterka
14806,244,123596,Manager employee skin. Could environmental per rather worry.,1,kolizja
